{
  "schemaVersion": "1.0",
  "recordType": "evidence-atlas-research-proposal",
  "proposalId": "ep-proposal:sha256:b922260bf2dd553614cf9007bc6946dea5285859ca5c55339db64f2476d7e814",
  "kind": "negative-tip",
  "title": "Bounded antecedent audit partially discharging the decision-sufficiency proposal's stop test",
  "question": "Does the existing Decision sufficiency on observation fibres proposal survive its declared stop test once the submitted antecedents on quotient factorisation, state abstraction, credal decisions and stability radii are checked directly?",
  "summary": "Audit whether the proposed general framework is substantially anticipated by established results in lumpability, aggregation, statistical sufficiency, state abstraction, robust decision theory and stability analysis. If so, close or reframe the programme as a bounded cross-field translation centred on any remaining Pearl-Manski junction.",
  "whyNow": "The existing proposal explicitly treats framework duplication as a stopping risk and records its prior-art search as not started. The submitted issue supplies named, section-level antecedents and a one-day reading gate, while also declaring unread sources and self-audit bias.",
  "submittedAt": "2026-08-16T05:29:37Z",
  "expiresAt": "2027-02-16T00:00:00Z",
  "submitter": {
    "actorType": "human-agent-collaboration",
    "displayName": "Dr Ian Pitchford and an Anthropic Claude research agent",
    "humanContributors": [
      "Dr Ian Pitchford"
    ],
    "agentContributors": [
      {
        "system": "Anthropic Claude",
        "model": "claude-opus-5 during drafting; claude-fable-5 at submission",
        "role": "Bounded antecedent search, primary-source retrieval and proposal drafting",
        "runRecordUrl": null,
        "provenanceNote": "The public GitHub issue reports three load-bearing sources as retrieved and read, but also identifies unread sources and supplies no immutable public model run record."
      }
    ],
    "contactUrl": "https://github.com/ipitchford/evidence-press-site/issues/92"
  },
  "atlasAnchors": [
    {
      "nodeId": "method:identification-gate",
      "basis": "The proposed framework begins by separating identification from later estimation or optimisation."
    },
    {
      "nodeId": "method:partial-identification",
      "basis": "Its decision question ranges over observationally admissible states rather than a single identified parameter."
    },
    {
      "nodeId": "method:certified-decision-margin",
      "basis": "The submitted antecedent audit directly queries whether stability-radius results already supply the proposed margin concept."
    },
    {
      "nodeId": "release:aggregation-without-sufficiency",
      "basis": "This release supplies the fibre-constancy statement and cites part of the antecedent literature under audit."
    }
  ],
  "sourceRefs": [
    "https://github.com/ipitchford/evidence-press-site/issues/92",
    "https://evidencepress.org/api/atlas-proposals.json",
    "https://proceedings.mlr.press/v48/abel16.html",
    "https://arxiv.org/abs/2603.18551",
    "https://doi.org/10.1214/aoms/1177728715",
    "https://doi.org/10.1214/aoms/1177729032",
    "https://doi.org/10.1007/978-1-4757-2876-7_4",
    "https://doi.org/10.1007/978-1-4612-1306-2_8",
    "https://doi.org/10.1111/j.1468-0262.2004.00530.x"
  ],
  "priorArtStatus": "bounded-search",
  "assessments": {
    "novelty": "unassessed",
    "importance": "unassessed",
    "tractability": "unassessed"
  },
  "cheapFalsifier": "Read Li, Walsh and Littman (2006), Ruggeri and Sivaganesan (2000), and Sotskov, Tanaev and Werner (1998) at the cited definitions and sections. If the four licence questions map to the state-abstraction hierarchy and the proposed margin maps to the established stability radius, close the general-framework route and retain only any independently supported junction claim.",
  "expectedInformationGain": "The audit should distinguish an already-established framework, a useful but non-novel translation across fields, and a narrower unresolved junction that could justify further work without overclaiming priority.",
  "resourceEstimate": {
    "class": "small",
    "basis": "The proposed first gate is a bounded direct reading of three named sources, expected to take less than one day."
  },
  "riskFlags": [
    "existing-framework-duplication",
    "cross-field-vocabulary-overreach",
    "incomplete-source-retrieval",
    "self-audit-bias"
  ],
  "currentState": "merged",
  "decisionReceipts": [
    {
      "receiptId": "ep-proposal-receipt:sha256:6839f6a7b78c24804482adbd359e341582023d32678f26522e95d5363e809564",
      "sequence": 1,
      "decidedAt": "2026-08-16T09:03:50Z",
      "fromState": "awaiting-review",
      "toState": "merged",
      "reviewer": {
        "actorType": "human-agent-collaboration",
        "displayName": "Evidence Press producer workflow",
        "provenanceNote": "Producer-side corpus review by the maintainer-agent workflow, informed by Fable issue 92; not independent subject-matter review or a complete antecedent audit."
      },
      "basis": "The negative tip was used to apply the older decision-sufficiency proposal's own stop rule. A predecessor-bound receipt now defers that programme pending direct reading of the closest antecedents and a narrower junction test; no accepted research-graph relationship was created.",
      "evidenceRefs": [
        "https://github.com/ipitchford/evidence-press-site/issues/92",
        "data/atlas-proposals/decision-sufficiency-observation-fibres.json"
      ],
      "inferenceLimit": "Merged means the warning was incorporated into proposal governance. It does not certify every cited mapping, establish that the programme has no novel residue, or endorse any scientific claim in the issue.",
      "predecessorReceiptId": null
    }
  ]
}
