{
  "schemaVersion": "1.0",
  "recordType": "evidence-atlas-research-proposal",
  "proposalId": "ep-proposal:sha256:49390b228b33cb4b875cdf3747b84f80373fac20080d3374c00afaf840f9f6c6",
  "kind": "research-programme",
  "title": "Decision sufficiency on observation fibres",
  "question": "Can target sufficiency, partial identification and robust optimisation be unified by characterising when one decision remains optimal across an observation fibre, with a certified margin to the nearest decision change?",
  "summary": "Develop a claim-neutral framework distinguishing parameter identification, target sufficiency and decision sufficiency, then seek exact or computable certificates for how far the admissible fibre or assumptions can vary before the robust action changes.",
  "whyNow": "The Evidence Atlas places identification-before-estimation, partial-identification and certified-decision-margin methods near several otherwise separate releases. That structural proximity suggests a bounded antecedent audit and counterexample programme, but does not establish a new connection or theory.",
  "submittedAt": "2026-08-15T19:30:00Z",
  "expiresAt": "2027-02-15T00:00:00Z",
  "submitter": {
    "actorType": "human-agent-collaboration",
    "displayName": "Dr Ian Pitchford and an OpenAI research agent",
    "humanContributors": [
      "Dr Ian Pitchford"
    ],
    "agentContributors": [
      {
        "system": "OpenAI Codex",
        "model": "Exact public model version not recorded",
        "role": "Atlas interpretation and research-programme synthesis",
        "runRecordUrl": null,
        "provenanceNote": "The suggestion arose in a maintainer-agent conversation on 15 August 2026. No immutable public transcript or independent priority audit is attached."
      }
    ],
    "contactUrl": "https://evidencepress.org/"
  },
  "atlasAnchors": [
    {
      "nodeId": "method:identification-gate",
      "basis": "The proposal begins with identification before estimation on a declared observation map."
    },
    {
      "nodeId": "method:partial-identification",
      "basis": "The proposed decision question is evaluated across a set of observationally admissible states."
    },
    {
      "nodeId": "method:certified-decision-margin",
      "basis": "The proposed certificate quantifies distance to a change in the robustly preferred action."
    }
  ],
  "sourceRefs": [
    "https://evidencepress.org/api/method-registry.json",
    "https://github.com/ipitchford/evidence-press-site/blob/main/docs/EVIDENCE_ATLAS.md"
  ],
  "priorArtStatus": "not-started",
  "assessments": {
    "novelty": "unassessed",
    "importance": "unassessed",
    "tractability": "unassessed"
  },
  "cheapFalsifier": "Run a primary-source antecedent and vocabulary audit. Stop or sharply narrow the programme if an existing framework already supplies equivalent definitions, decision criteria and margin certificates.",
  "expectedInformationGain": "The audit should determine whether the apparent synthesis is terminological, a useful translation between established fields, or a defensible gap supporting a compact definitions-and-counterexamples paper.",
  "resourceEstimate": {
    "class": "medium",
    "basis": "The first gate is a bounded literature and counterexample audit; a general theory or software implementation would be a later, separately authorised project."
  },
  "riskFlags": [
    "cross-field-vocabulary-overreach",
    "existing-framework-duplication",
    "self-citation-bias"
  ],
  "currentState": "awaiting-review",
  "decisionReceipts": []
}
